{
  "$schema": "http://json-schema.org/draft-07/schema#",
  "title": "Patient",
  "type": "object",
  "required": ["first_name", "last_name"],
  "properties": {
    "id": { "type": "string", "format": "uuid" },
    "first_name": { "type": "string", "minLength": 1 },
    "last_name": { "type": "string", "minLength": 1 },
    "birth_date": { "type": "string", "format": "date" },
    "gender": { "type": "string", "enum": ["male", "female", "other", "unknown"] },
    "phone": { "type": ["string", "null"], "minLength": 6 },
    "email": { "type": ["string", "null"], "format": "email" },
    "medical_history": { "type": ["string", "null"] },
    "allergies": {
      "type": ["array", "null"],
      "items": { "type": "string" }
    },
    "metadata": { "type": "object" },
    "created_at": { "type": "string", "format": "date-time" },
    "updated_at": { "type": "string", "format": "date-time" }
  },
  "additionalProperties": false
}
