[
  {
    "id": "a3f1c9f0-1d3b-4b5a-9d7f-111111111111",
    "first_name": "Marie",
    "last_name": "Dupont",
    "birth_date": "1986-04-12",
    "gender": "female",
    "phone": "+33 6 12 34 56 78",
    "email": "marie.dupont@example.com",
    "medical_history": "Hypertension légère; aspirine occasionnelle.",
    "allergies": ["pollen"],
    "metadata": { "preferred_language": "fr" },
    "created_at": "2025-12-01T10:00:00Z",
    "updated_at": "2025-12-01T10:00:00Z"
  },
  {
    "id": "b4f2d0e1-2e4c-5c6b-0a8f-222222222222",
    "first_name": "Ali",
    "last_name": "Ben",
    "birth_date": "1992-09-30",
    "gender": "male",
    "phone": "+33 7 98 76 54 32",
    "email": "ali.ben@example.com",
    "medical_history": "Aucun antécédent majeur.",
    "allergies": [],
    "metadata": { "notes": "Patient prefer English" },
    "created_at": "2025-12-02T08:30:00Z",
    "updated_at": "2025-12-02T08:30:00Z"
  },
  {
    "id": "c5e3f1a2-3f5d-6d7c-1b9f-333333333333",
    "first_name": "Sophie",
    "last_name": "Martin",
    "birth_date": "1975-01-20",
    "gender": "female",
    "phone": null,
    "email": "sophie.martin@example.com",
    "medical_history": "Diabète de type 2.",
    "allergies": ["penicillin", "latex"],
    "metadata": {},
    "created_at": "2025-12-03T14:12:00Z",
    "updated_at": "2025-12-03T14:12:00Z"
  }
]
